{
  "active_workers": [],
  "additional_model_usage_justified": "No additional model call is justified until a real problem is formalized.",
  "blocking_gaps": [
    "No production research question, assumptions, or notation have been entered.",
    "Benchmark answer keys still require independent human review."
  ],
  "budget_mode": "BALANCED",
  "configured_unverified_models": [
    "gpt-5.6-luna",
    "gpt-5.5",
    "gpt-5.4-mini"
  ],
  "current_execution_mode": "MODE_A_NATIVE_MULTI_MODEL",
  "current_objective": "Initialize and validate ProofWeave before entering a production research problem.",
  "disabled_models": [
    "codex_cli_subprocess",
    "claude_code_subprocess",
    "openai_api",
    "anthropic_api",
    "openai_compatible_endpoint",
    "gateway"
  ],
  "downgrades": [],
  "escalations": [],
  "failed_approaches": [
    "latexmk requires Perl on this host; the verified build path uses pdflatex directly."
  ],
  "latest_experiments": [
    "experiments/configs/sample_experiment.yml is a harness smoke test and makes no mathematical claim."
  ],
  "next_recommended_action": "Enter the first research problem and run workflows 00 and 01 without attempting a proof.",
  "proposed_results": [],
  "recent_routing_decisions": [],
  "refuted_claims": [],
  "tasks_lacking_independent_verification": [
    "Bundled benchmark answer keys",
    "Any future production theorem until a cold-start verifier accepts it"
  ],
  "updated_at": "2026-07-24T07:39:36.609844Z",
  "verified_available_models": [
    "gpt-5.6-sol",
    "gpt-5.6-terra"
  ],
  "verified_results": []
}
